{
  "$schema": "https://json-schema.org/draft/2020-12/schema",
  "$id": "https://github.com/2233admin/design-pipeline/schema/toolchain-request.v1.json",
  "title": "Unified Frontend Toolchain Request",
  "type": "object",
  "additionalProperties": false,
  "required": ["schema", "framework", "brief", "jobId", "jobPlanSha256", "jobPlanPath", "deliverableForm"],
  "properties": {
    "schema": { "const": "design-pipeline.toolchain-request.v1" },
    "framework": { "enum": ["react", "svelte", "vue", "solid", "reflex", "agnostic"] },
    "brief": { "type": "string", "minLength": 1 },
    "jobId": { "type": "string", "minLength": 1 },
    "jobPlanSha256": { "type": "string", "pattern": "^[a-f0-9]{64}$" },
    "jobPlanPath": { "type": "string", "minLength": 1 },
    "targetRoot": {
      "description": "Target package directory relative to the CLI --root, where toolchain resolve checks the directory and toolchain probe runs. Defaults to \".\" when omitted. Backslashes, \"./\" and a trailing \"/\" are canonicalised; absolute paths, ':' and '..' segments are rejected.",
      "type": "string",
      "minLength": 1,
      "not": { "pattern": "(^[\\\\/])|:|(^|[\\\\/])\\.\\.([\\\\/]|$)" }
    },
    "deliverableForm": { "enum": ["product-launch-video", "motion-graphics-video", "scrollytelling-page", "interactive-page", "ui-motion"] },
    "existing": { "type": "object" },
    "requested": { "type": "object" },
    "capabilities": {
      "type": "array",
      "uniqueItems": true,
      "items": { "type": "string", "minLength": 1 }
    },
    "context": { "type": "object" },
    "graphics": {
      "type": "object",
      "additionalProperties": false,
      "minProperties": 1,
      "properties": {
        "family": { "type": "string", "minLength": 1 },
        "adapter": { "type": "string", "minLength": 1 }
      }
    }
  }
}
